ID,Description_lang,Reward_lang,Title_lang
5124,Compi le imprese delle spedizioni eroiche di Wrath of the Lich King elencate qui sotto con un gruppo di gilda.,,Eroe delle spedizioni di gilda di Wrath of the Lich King
5126,Diventa Osannato dalle fazioni delle spedizioni elencate qui sotto.,,Diplomatico delle spedizioni
5127,Diventa Osannato dalle fazioni delle incursioni elencate qui sotto.,,Rappresentante delle incursioni
5128,Diventa Osannato dalle fazioni dei campi di battaglia classici elencate qui sotto.,,Battaglie classiche
5129,Porta 25 reputazioni a Osannato.,,Ambasciatori
5130,Porta 15 reputazioni a Osannato.,,Diplomazia
5131,Diventa Osannato dalle fazioni dei campi di battaglia classici elencate qui sotto.,,Battaglie classiche
5132,Vinci un campo di battaglia classificato con un gruppo di gilda.,,Richiamo del dovere
5134,Sconfiggi Obsidius l'Asceso nelle Caverne di Roccianera in modalità Eroica con un gruppo di gilda.,,Eroica di gilda: Caverne di Roccianera
5135,Sconfiggi Ozumat nel Trono delle Maree in modalità Eroica con un gruppo di gilda.,,Eroica di gilda: Trono delle Maree
5136,Sconfiggi la Gran Sacerdotessa Azil nel Nucleo di Pietra in modalità Eroica con un gruppo di gilda.,,Eroica di gilda: Nucleo di Pietra
5137,Sconfiggi Asaad al Pinnacolo del Vortice in modalità Eroica con un gruppo di gilda.,,Eroica di gilda: Pinnacolo del Vortice
5138,Sconfiggi Erudax a Grim Batol in modalità Eroica con un gruppo di gilda.,,Eroica di gilda: Grim Batol
5139,Sconfiggi Rajh nelle Sale della Creazione in modalità Eroica con un gruppo di gilda.,,Eroica di gilda: Sale della Creazione
5140,"Sconfiggi Siamat, Signore del Vento del Sud nella Città Perduta dei Tol'vir in modalità Eroica con un gruppo di gilda.",,Eroica di gilda: Città Perduta dei Tol'vir
5141,Sconfiggi Vanessa VanCleef nelle Miniere della Morte in modalità Eroica con un gruppo di gilda.,,Eroica di gilda: Miniere della Morte
5142,Sconfiggi Ser Godfrey nel Forte di Zannascura in modalità Eroica con un gruppo di gilda.,,Eroica di gilda: Forte di Zannascura
5143,Compi le imprese delle spedizioni eroiche di Cataclysm elencate qui sotto con un gruppo di gilda.,Ricompensa: Stendardo dell'Unità,Eroe delle spedizioni di gilda di Cataclysm
5144,Uccidi 50.000 animali.,"Ricompensa: mascotte ""Cucciolo di Armadillo""",Squadra della morte animalesca
5145,Diventa Osannato dalle fazioni delle spedizioni elencate qui sotto.,,Diplomatico delle spedizioni
5151,Raggiungi il livello massimo con ciascuna delle classi degli Umani elencate qui sotto.,,Umani di classe
5152,Compi le imprese di classe elencate qui sotto.,Ricompensa: Buono per la Banca di Gilda (Scheda 8),Che classe!
5153,Raggiungi il livello massimo con ciascuna delle classi degli Elfi della Notte elencate qui sotto.,,Elfi della Notte di classe
5154,Raggiungi il livello massimo con ciascuna delle classi degli Gnomi elencate qui sotto.,,Gnomi di classe
5155,Raggiungi il livello massimo con ciascuna delle classi dei Nani elencate qui sotto.,,Nani di classe
5156,Raggiungi il livello massimo con ciascuna delle classi dei Draenei elencate qui sotto.,,Draenei di classe
5157,Raggiungi il livello massimo con ciascuna delle classi dei Worgen elencate qui sotto.,,Worgen di classe
5158,Compi le imprese di classe elencate qui sotto.,Ricompensa: Buono per la Banca di Gilda (Scheda 8),Che classe!
5159,Realizza 100.000 uccisioni onorevoli.,,Squadrone della morte
5160,Raggiungi il livello massimo con ciascuna delle classi degli Orchi elencate qui sotto.,,Orchi di classe
5161,Raggiungi il livello massimo con ciascuna delle classi dei Tauren elencate qui sotto.,,Tauren di classe
5162,Raggiungi il livello massimo con ciascuna delle classi dei Troll elencate qui sotto.,,Troll di classe
5163,Raggiungi il livello massimo con ciascuna delle classi degli Elfi del Sangue elencate qui sotto.,,Elfi del Sangue di classe
5164,Raggiungi il livello massimo con ciascuna delle classi dei Non Morti elencate qui sotto.,,Non Morti di classe
5165,Raggiungi il livello massimo con ciascuna delle classi dei Goblin elencate qui sotto.,,Goblin di classe
5166,Vinci 100 battaglie classificate nel Bacino d'Arathi mentre controlli tutte e 5 le bandiere in un gruppo di gilda.,,Cinque per cinque
5167,Realizza un'uccisione onorevole di ciascuna delle classi di Orchi di livello 35 o superiore elencate qui sotto.,,Uccisore di Orchi
5168,Realizza un'uccisione onorevole di ciascuna delle classi di Tauren di livello 35 o superiore elencate qui sotto.,,Uccisore di Tauren
5169,Realizza un'uccisione onorevole di ciascuna delle classi di Non Morti di livello 35 o superiore elencate qui sotto.,,Uccisore di Non Morti
5170,Realizza un'uccisione onorevole di ciascuna delle classi di Troll di livello 35 o superiore elencate qui sotto.,,Uccisore di Troll
5171,Realizza un'uccisione onorevole di ciascuna delle classi di Elfi del Sangue di livello 35 o superiore elencate qui sotto.,,Uccisore di Elfi del Sangue
5172,Realizza un'uccisione onorevole di ciascuna delle classi di Goblin di livello 35 o superiore elencate qui sotto.,,Uccisore di Goblin
5173,Realizza un'uccisione onorevole di ciascuna delle classi di Umani di livello 35 o superiore elencate qui sotto.,,Uccisore di Umani
5174,Realizza un'uccisione onorevole di ciascuna delle classi di Elfi della Notte di livello 35 o superiore elencate qui sotto.,,Uccisore di Elfi della Notte
5175,Realizza un'uccisione onorevole di ciascuna delle classi di Nani di livello 35 o superiore elencate qui sotto.,,Uccisore di Nani
5176,Realizza un'uccisione onorevole di ciascuna delle classi di Gnomi di livello 35 o superiore elencate qui sotto.,,Uccisore di Gnomi
5177,Realizza un'uccisione onorevole di ciascuna delle classi di Draenei di livello 35 o superiore elencate qui sotto.,,Uccisore di Draenei
5178,Realizza un'uccisione onorevole di ciascuna delle classi di Worgen di livello 35 o superiore elencate qui sotto.,,Uccisore di Worgen
5179,Compi le imprese da uccisore elencate qui sotto.,"Ricompensa: mascotte ""Paggio di Gilda""",Sterminatore dell'Alleanza
5180,Apprendi la competenza Maestro in Equitazione.,,Oltre la barriera del suono
5184,"Possessore di Furiatonante, Lama Benedetta del Vento Eterno.",,"Gilda: Furiatonante, Lama Benedetta del Vento Eterno"
5185,Possessore del completo Lame da Guerra di Azzinoth.,,Gilda: Lame da Guerra di Azzinoth
5186,"Possessore di Thori'dal, Furia delle Stelle.",,"Gilda: Thori'dal, Furia delle Stelle"
5187,"Possessore di Val'anyr, Martello degli Antichi Re.",,"Gilda: Val'anyr, Martello degli Antichi Re"
5188,Portatore di Tenebranima.,,Gilda: Tenebranima
5191,Recupera i seguenti manufatti degli Elfi della Notte che raccontano la tragica storia di Pyramond e Theleste.,,Tragedia in tre atti
5192,Scopri come è stato ucciso il Capoclan Orco Hargal recuperando i seguenti manufatti.,,...Più rumore fanno quando cadono
5193,Scopri chi ha ucciso Kaldrigos il Dragone del Terrore trovando i seguenti manufatti.,,Tracce blu
5194,Uccidi 2.500 giocatori nemici in una capitale qualsiasi dell'Alleanza.,,Rappresaglia cittadina
5195,Uccidi 2.500 giocatori nemici in una capitale qualsiasi dell'Orda.,,Rappresaglia cittadina
5196,Acquista la settima scheda della banca di gilda.,,Spazio aggiuntivo
5198,Conquista 2.000 punti impresa di gilda.,,Questo sì che è un obiettivo
5201,Depreda 100.000 monete d'oro dalle creature.,"Ricompensa: mascotte ""Alfiere di Gilda""",Profitti e dividendi
5203,Realizza 1.000.000 uccisioni onorevoli.,,Assassini professionisti
5208,Vinci 2 battaglie nei Picchi Gemelli.,,Sul picco due volte
5209,Conquista 100 vittorie nei Picchi Gemelli.,,Veterano dei Picchi Gemelli
5210,Prendi e cattura personalmente la bandiera 2 volte nei Picchi Gemelli.,,Doppia consegna
5211,Riporta 50 bandiere come difensore nei Picchi Gemelli.,,Difensore totale
5213,Uccidi 100 portatori della bandiera nei Picchi Gemelli.,,Grande spirito
5214,Uccidi 100 portatori della bandiera nei Picchi Gemelli.,,Grande spirito
5215,Vinci nei Picchi Gemelli con un punteggio di 3 a 0 realizzando almeno un colpo di grazia.,,Parto trigemino
5216,Vinci una battaglia nei Picchi Gemelli in meno di 7 minuti.,,Picchi di velocità
5219,"In una singola battaglia nei Picchi Gemelli, uccidi 2 portatori della bandiera prima che escano dalla Roccaforte dei Granmartello.",,Sono nel Rifugio Bianco
5220,"In una singola battaglia nei Picchi Gemelli, uccidi 2 portatori della bandiera prima che escano dalla Sala della Bandiera delle Fauci di Drago.",,Sono nella Loggia Nera
5221,Cattura e consegna la bandiera in meno di 75 secondi.,,"Fuoco, cammina con me"
5222,Cattura e consegna la bandiera in meno di 75 secondi.,,"Fuoco, cammina con me"
5223,Compi le imprese dei Picchi Gemelli elencate qui sotto.,,Maestro dei Picchi Gemelli
5226,"In una singola battaglia nei Picchi Gemelli, cattura e riporta 9 bandiere.",,Euforia
5227,"In una singola battaglia nei Picchi Gemelli, cattura e riporta 9 bandiere.",,Euforia
5228,Uccidi 5 Nani in una singola battaglia nei Picchi Gemelli.,,Martellamento selvaggio
5229,Uccidi 5 Orchi in una singola battaglia nei Picchi Gemelli.,,Calci nelle fauci
5230,/ruggisci quando hai la bandiera e sei affetto dai benefici Velocità e Berserker.,,Montanaro dei Picchi Gemelli
5231,Vinci una battaglia nei Picchi Gemelli dopo essere stato in svantaggio per 0 a 2.,,Lascia o raddoppia
5232,Battaglie nei Picchi Gemelli,,Battaglie nei Picchi Gemelli
5233,Vittorie nei Picchi Gemelli,,Vittorie nei Picchi Gemelli
5234,Bandiere catturate nei Picchi Gemelli,,Bandiere catturate nei Picchi Gemelli
5235,Bandiere riportate nei Picchi Gemelli,,Bandiere riportate nei Picchi Gemelli
5236,Battaglie per Gilneas,,Battaglie per Gilneas
5237,Vittorie nella Battaglia per Gilneas,,Vittorie nella Battaglia per Gilneas
5239,Completa 50.000 missioni.,,Un sacco di testo da leggere
5240,Vinci 1.000 campi di battaglia classificati con un gruppo di gilda.,,Lavoro di squadra
5241,Vinci 2.000 campi di battaglia classificati con un gruppo di gilda.,,Restate uniti!
5244,Vinci 5.000 campi di battaglia classificati con un gruppo di gilda.,,"Tutti per uno, uno per tutti"
5245,Vinci una Battaglia per Gilneas.,,Vittoria nella Battaglia per Gilneas
5246,Conquista 100 vittorie nella Battaglia per Gilneas.,,Veterano della Battaglia per Gilneas
5247,Vinci una Battaglia per Gilneas con un punteggio di 1.500 a 0.,,Luna piena
5248,Prendi 50 bandiere nella Battaglia per Gilneas.,,Sbandieratore devoto
5249,Assalta 2 basi in una singola Battaglia per Gilneas.,,Doppietta fatale
5250,Difendi 2 basi in una singola Battaglia per Gilneas.,,Fuori dalla nebbia
5251,Vai in difesa di una base riportando la bandiera 10 volte nella Battaglia per Gilneas.,,Fuori dalla norma
5252,Recupera uno svantaggio di 500 risorse e vinci una Battaglia per Gilneas.,,Non dire gatto se non ce l'hai nel sacco!
5253,Vinci 10 volte nella Battaglia per Gilneas mentre controlli tutte e 3 le bandiere.,,Copertura totale
5254,Vinci una Battaglia per Gilneas in 6 minuti.,,Guerra lampo
5255,Vinci con uno scarto di 100 punti o meno nella Battaglia per Gilneas.,,Per un pelo!
5256,Assalta e difendi una base in una singola Battaglia per Gilneas.,,Stella della Battaglia per Gilneas
5257,Realizza 10 uccisioni onorevoli in ogni base in una singola Battaglia per Gilneas.,,Assassino della Battaglia per Gilneas
5258,Compi le imprese della Battaglia per Gilneas elencate qui sotto.,,Maestro della Battaglia per Gilneas
5262,Resta /senzafiato sotto il doppio arcobaleno nella Battaglia per Gilneas.,,Doppio arcobaleno
5263,Uccidi 100.000 animali,,Animaleddon
5264,Completa 30.000 missioni giornaliere.,,Eroi di tutti i giorni
5265,Completa 75.000 missioni giornaliere.,,Giornate senza tregua
5266,Raggiungi un indice personale di 2.400 nelle arene 3v3.,,Tre cuori in afflitto: 2.400
5267,Raggiungi un indice personale di 2.700 nelle arene 3v3.,,Tre cuori in afflitto: 2.700
5268,Vinci un campo di battaglia classificato.,,Al servizio dell'Alleanza
5269,Vinci un campo di battaglia classificato.,,Al servizio dell'Orda
5273,Vinci 500 arene classificate con un gruppo di gilda.,,Metodo amichevole
5274,Pesca 25.000 pesci dai banchi di pesci.,,Avremo bisogno di una barca più grande
5275,Vinci 1.000 arene classificate con un gruppo di gilda.,,Uccidere in compagnia
5281,Sconfiggi Rom'ogg Spaccaossa dopo avere utilizzato la sua abilità Spaccacranio per uccidere 10 Furie della Terra nelle Caverne di Roccianera in modalità Eroica.,,Spaccaossa e spaccacrani
5282,"Permetti ai tre Zeloti di Corla di evolversi, poi uccidili e sconfiggi Corla nelle Caverne di Roccianera in modalità Eroica.",,Sviluppo interrotto
5283,Sconfiggi Karsh Piegacciaio dopo che ha raggiunto 15 accumuli di Armatura d'Argentovivo Surriscaldata nelle Caverne di Roccianera in modalità Eroica.,,Scotta troppo!
5284,Sconfiggi Obsidius l'Asceso senza che alcun membro del gruppo raggiunga 4 accumuli di Velo Crepuscolare nelle Caverne di Roccianera in modalità Eroica.,,Ascesa crepuscolare
5285,Fai in modo che Dama Naz'jar uccida uno dei suoi servitori con l'abilità Geyser nel Trono delle Maree in modalità Eroica.,,Fedelissimo
5286,Sconfiggi un Behemoth Implacabile mentre sei sotto l'effetto dell'Inoculazione Mareale ottenuta durante l'incontro con Ozumat nel Trono delle Maree in modalità Eroica.,,Principe delle maree
5287,Sconfiggi 60 Fedeli Devoti entro 10 secondi durante l'incontro con la Gran Sacerdotessa Azil nel Nucleo di Pietra in modalità Eroica.,,Nucleo nucleare
5288,Evita completamente l'effetto Aderenza Statica durante l'incontro con Asaad al Pinnacolo del Vortice in modalità Eroica.,,Stasi statica
5289,Raccogli 5 Sfere Dorate in una singola visita al Pinnacolo del Vortice in modalità Eroica.,,Livello bonus!
5290,Sconfiggi 3 Anime Ardenti durante l'incontro con il Gran Profeta Barim nella Città Perduta dei Tol'vir in modalità Eroica.,,Fuoco purificatore
5291,Sconfiggi 20 Crocolischi Furiosi entro 10 secondi durante l'incontro con Morsasalda nella Città Perduta dei Tol'vir in modalità Eroica.,,Acrocalypse Now
5292,"Sconfiggi Siamat, Signore del Vento del Sud, con 3 accumuli di Carica Fulminante nella Città Perduta dei Tol'vir in modalità Eroica.",,Benvenuti al sud
5293,Sconfiggi il Guardiano del Tempio Anhuur senza permettergli di cantare il suo Inno Risonante per più di 15 secondi nelle Sale della Creazione in modalità Eroica.,,Odio quella canzone
5294,Sconfiggi lo Spaccaterra Ptah mentre cavalchi un Dromedario nelle Sale della Creazione in modalità Eroica.,,La goccia che ha fatto traboccare il dromedario
5295,Sconfiggi Rajh prima che completi un'intera fase di ricarica nelle Sale della Creazione in modalità Eroica.,,Soleva beccar... mazzate
5296,Completa l'evento della Volta delle Luci nelle Sale della Creazione in meno di 5 minuti in modalità Eroica.,,Più veloce della luce
5297,Sconfiggi il Generale Umbriss mentre è sotto l'effetto della Malizia di Modgud a Grim Batol in modalità Eroica.,,Offese di Umbriss
5298,Sconfiggi Erudax senza permettere a un Corruttore Senzavolto di lanciare la Corruzione del Crepuscolo sulle Uova di Alexstrasza a Grim Batol in modalità Eroica.,,Si può fare una frittata senza rompere le uova
5300,Sconfiggi Halfus Spezzadragoni dopo aver eliminato 2 drachi entro 10 secondi l'uno dall'altro. Il gruppo di Draghetti di Smeraldo conta come un draco.,,L'unica via di fuga
5301,Recupera i seguenti manufatti Tol'vir che narrano l'ascesa e la caduta dell'Imperatore Ninjter.,,Il ragazzo che voleva essere re
5304,Sconfiggi il Conclave del Vento nel Trono dei Quattro Venti mentre tutti i membri del gruppo hanno almeno 7 accumuli di Brividi Ventosi.,,Calma e sangue freddo
5305,Sconfiggi Al'Akir nel Trono dei Quattro Venti mentre è sotto l'effetto di Retroazione.,,Gioco a quattro
5306,Sconfiggi Rodimagma nei Sotterranei dell'Ala Nera senza che alcun membro del gruppo venga infettato da un parassita.,,Antiparassitario
5307,Sconfiggi il Sistema di Difesa Omnotron nei Sotterranei dell'Ala Nera neutralizzando i seguenti attacchi.,,Obiet-tivo-tron
5308,Sconfiggi Atramedes nei Sotterranei dell'Ala Nera senza che la Barra del Suono di alcun membro del gruppo superi il 50%.,,Il silenzio è d'oro
5309,Sconfiggi Chimaeron nei Sotterranei dell'Ala Nera senza che muoiano più di 2 membri del gruppo.,,"Mors tua, vita mea"
5310,"Uccidi 12 Aberrazioni entro 10 secondi durante lo scontro con Maloriak nei Sotterranei dell'Ala Nera, poi sconfiggi Maloriak.",,Comportamento aberrante
5311,Sconfiggi la Mostruosità di Elementio nel Bastione del Crepuscolo permettendogli di creare una sola pozza di Ghiaccio Liquido.,,Elementare
5312,Sconfiggi Cho'gall nel Bastione del Crepuscolo prima che un membro del gruppo superi il 30% di Sangue Corrotto.,,L'abisso guarderà dentro di te
5313,Hai sconfitto Sinestra nel Bastione del Crepuscolo in modalità Eroica al primo tentativo senza che alcun membro del gruppo sia morto.,,L'eco dalla mia vittoria sovrasta le tue parole
5315,Trova 10 manufatti comuni.,,Scavatore
5317,"Uccidi 10 Attendenti di Schnottz con un colpo di artiglieria durante la missione giornaliera ""Fuoco dal cielo"" a Uldum.",,Come ho imparato ad amare la bomba
5318,"Completa le missioni di Neptulon a Vashj'ir fino a ""Difendi la Fenditura"" compresa.",,20.000 leghe sotto i mari
5319,"Completa le missioni di Neptulon a Vashj'ir fino a ""Difendi la Fenditura"" compresa.",,20.000 leghe sotto i mari
5320,"Completa la serie di missioni del Martello del Crepuscolo nelle Alture del Crepuscolo fino a ""Sfasciateste la Montagna"" compresa.",,Re della montagna
5321,"Completa la serie di missioni del Martello del Crepuscolo nelle Alture del Crepuscolo fino a ""Sfasciateste la Montagna"" compresa.",,Re della montagna
5322,Vinci 10 campi di battaglia classificati.,,Al servizio dell'Alleanza
5323,Vinci 10 campi di battaglia classificati.,,Al servizio dell'Orda
5324,Vinci 25 campi di battaglia classificati.,,Al servizio dell'Orda
5325,Vinci 75 campi di battaglia classificati.,"Ricompensa: cavalcatura ""Lupo da Guerra Malvagio"" e titolo ""Veterano dell'Orda""",Veterano dell'Orda
5326,Vinci 300 campi di battaglia classificati.,"Ricompensa: cavalcatura ""Lupo da Guerra Malvagio"" e titolo ""Araldo della Guerra""",Araldo della Guerra dell'Orda
5327,Vinci 25 campi di battaglia classificati.,,Al servizio dell'Alleanza
5328,Vinci 75 campi di battaglia classificati.,"Ricompensa: cavalcatura ""Destriero da Guerra Malvagio"" e titolo ""Veterano dell'Alleanza""",Veterano dell'Alleanza
5329,Vinci 300 campi di battaglia classificati.,"Ricompensa: cavalcatura ""Destriero da Guerra Malvagio"" e titolo ""il Guerrafondaio""",Veterano Guerrafondaio dell'Alleanza
5330,Raggiungi un indice dei campi di battaglia classificati di 1.100.,"Ricompensa: titolo ""Soldato""",Soldato
5331,Raggiungi un indice dei campi di battaglia classificati di 1.200.,"Ricompensa: titolo ""Caporale""",Caporale
5332,Raggiungi un indice dei campi di battaglia classificati di 1.300.,"Ricompensa: titolo ""Sergente""",Sergente
5333,Raggiungi un indice dei campi di battaglia classificati di 1.400.,"Ricompensa: titolo ""Sergente Capo""",Sergente Capo
5334,Raggiungi un indice dei campi di battaglia classificati di 1.500.,"Ricompensa: titolo ""Sergente Maggiore""",Sergente Maggiore
5335,Raggiungi un indice dei campi di battaglia classificati di 1.600.,"Ricompensa: titolo ""Cavaliere""",Cavaliere
5336,Raggiungi un indice dei campi di battaglia classificati di 1.700.,"Ricompensa: titolo ""Cavalier Tenente""",Cavalier Tenente
5337,Raggiungi un indice dei campi di battaglia classificati di 1.800.,"Ricompensa: titolo ""Cavalier Capitano""",Cavalier Capitano
5338,Raggiungi un indice dei campi di battaglia classificati di 1.900.,"Ricompensa: titolo ""Centurione""",Centurione
5339,Raggiungi un indice dei campi di battaglia classificati di 2.000.,"Ricompensa: titolo ""Tenente Comandante""",Tenente Comandante
5340,Raggiungi un indice dei campi di battaglia classificati di 2.100.,"Ricompensa: titolo ""Comandante""",Comandante
5341,Raggiungi un indice dei campi di battaglia classificati di 2.200.,"Ricompensa: titolo ""Maresciallo""",Maresciallo
5342,Raggiungi un indice dei campi di battaglia classificati di 2.300.,"Ricompensa: titolo ""Signore della Guerra""",Signore della Guerra
5343,Raggiungi un indice dei campi di battaglia classificati di 2.400.,"Ricompensa: titolo ""Gran Maresciallo""",Gran Maresciallo
5344,"Hai concluso la Stagione 9 del PvP tra i primi 0,5% nella graduatoria dei campi di battaglia classificati.",,Eroe dell'Alleanza: Malvagio
5345,Raggiungi un indice dei campi di battaglia classificati di 1.100.,"Ricompensa: titolo ""Sentinella""",Sentinella
5346,Raggiungi un indice dei campi di battaglia classificati di 1.200.,"Ricompensa: titolo ""Grunt""",Grunt
5347,Raggiungi un indice dei campi di battaglia classificati di 1.300.,"Ricompensa: titolo ""Sergente""",Sergente
5348,Raggiungi un indice dei campi di battaglia classificati di 1.400.,"Ricompensa: titolo ""Sergente Istruttore""",Sergente Istruttore
5349,Raggiungi un indice dei campi di battaglia classificati di 1.500.,"Ricompensa: titolo ""Primo Sergente""",Primo Sergente
5350,Raggiungi un indice dei campi di battaglia classificati di 1.600.,"Ricompensa: titolo ""Guardia di Pietra""",Guardia di Pietra
5351,Raggiungi un indice dei campi di battaglia classificati di 1.700.,"Ricompensa: titolo ""Guardia di Sangue""",Guardia di Sangue
5352,Raggiungi un indice dei campi di battaglia classificati di 1.800.,"Ricompensa: titolo ""Legionario""",Legionario
5353,Raggiungi un indice dei campi di battaglia classificati di 2.000.,"Ricompensa: titolo ""Campione""",Campione
5354,Raggiungi un indice dei campi di battaglia classificati di 2.100.,"Ricompensa: titolo ""Tenente Generale""",Tenente Generale
5355,Raggiungi un indice dei campi di battaglia classificati di 2.200.,"Ricompensa: titolo ""Generale""",Generale
5356,Raggiungi un indice dei campi di battaglia classificati di 2.400.,"Ricompensa: titolo ""Gran Signore della Guerra""",Gran Signore della Guerra
5357,Raggiungi un indice dei campi di battaglia classificati di 2.300.,"Ricompensa: titolo ""Primo Maresciallo""",Primo Maresciallo
5358,"Hai concluso la Stagione 9 del PvP tra i primi 0,5% nella graduatoria dei campi di battaglia classificati.",,Eroe dell'Orda: Malvagio
5359,Raggiungi un indice dei campi di battaglia classificati di 1.900.,"Ricompensa: titolo ""Cavalier Campione""",Cavalier Campione
5362,Crea e acquista un'Insegna di Gilda.,,Tutti hanno bisogno di un simbolo
5363,Realizza 250.000 uccisioni onorevoli.,"Ricompensa: titolo ""il Sanguinario""",250.000 uccisioni onorevoli
5366,Non farti colpire dal Muro di Fuoco durante il combattimento con Glubtok nelle Miniere delle Morte in modalità Eroica.,,Pronto per le incursioni
5367,Uccidi 20 Ratti delle Miniere durante il combattimento con Helix Spaccaferro nelle Miniere della Morte in modalità Eroica.,,Ratto matto
5368,Impedisci che la salute del Prototipo di Mietitore scenda sotto il 90% prima che il Mietinemici 5000 venga sconfitto nelle Miniere della Morte in modalità Eroica.,,Prototipo prodigioso
5369,Permetti a 3 Vapori Ghiacciati di lanciare Brinamento Esplosivo durante il combattimento con l'Ammiraglio Ghignotruce nelle Miniere della Morte in modalità Eroica.,,Danno glaciale
5370,Non accumulare più di un effetto di Nausea durante il combattimento con Dolcetto nelle Miniere della Morte in modalità Eroica.,,Sono a dieta
5371,Affronta Vanessa VanCleef entro 5 minuti dal momento in cui ti è stato inflitto l'Elisir dell'Incubo nelle Miniere della Morte in modalità Eroica.,,Vendicatore vigoroso di VanCleef
5372,Equipaggia un oggetto epico con un livello minimo di 359 in ogni scomparto (prima di Battle for Azeroth).,,Cataclismicamente epico
5373,Equipaggia un oggetto superiore con un livello minimo di 333 in ogni scomparto (prima di Battle for Azeroth).,,Cataclismicamente superiore
5374,Porta 45 reputazioni a Osannato.,,Osannato da 45 fazioni
5375,Diventa Osannato dai Custodi di Baradin.,,Custodi di Baradin
5376,Diventa Osannato dall'Avanguardia di Malogrido.,,Avanguardia di Malogrido
5377,Possessore della mascotte Piccolo Alamorte della Collector's Edition di Cataclysm.,,Collector's Edition: Piccolo Alamorte
5378,Fiero possessore dell'Uovo di Murloc di Morty della BlizzCon 2010.,,Morty
5381,Il primo giocatore del reame a raggiungere 525 punti competenza in Alchimia.,,Primo del reame! Illustre Gran Maestro Alchimista
5382,Il primo giocatore del reame a raggiungere 525 punti competenza in Forgiatura.,,Primo del reame! Illustre Gran Maestro Fabbro
5383,Il primo giocatore del reame a raggiungere 525 punti competenza in Cucina.,,Primo del reame! Illustre Gran Maestro Cuoco
5384,Il primo giocatore del reame a raggiungere 525 punti competenza in Incantamento.,,Primo del reame! Illustre Gran Maestro Incantatore
5385,Il primo giocatore del reame a raggiungere 525 punti competenza in Ingegneria.,,Primo del reame! Illustre Gran Maestro Ingegnere
5386,Il primo giocatore del reame a raggiungere 525 punti competenza in Primo Soccorso.,,Primo del reame! Illustre Gran Maestro Medico
5387,Il primo giocatore del reame a raggiungere 525 punti competenza in Pesca.,,Primo del reame! Illustre Gran Maestro Pescatore
5388,Il primo giocatore del reame a raggiungere 525 punti competenza in Erbalismo.,,Primo del reame! Illustre Gran Maestro Erbalista
5389,Il primo giocatore del reame a raggiungere 525 punti competenza in Runografia.,,Primo del reame! Illustre Gran Maestro Runografo
5390,Il primo giocatore del reame a raggiungere 525 punti competenza in Oreficeria.,,Primo del reame! Illustre Gran Maestro Orefice
5391,Il primo giocatore del reame a raggiungere 525 punti competenza in Conciatura.,,Primo del reame! Illustre Gran Maestro Conciatore
5392,Il primo giocatore del reame a raggiungere 525 punti competenza in Estrazione.,,Primo del reame! Illustre Gran Maestro Minatore
