ID,Description_lang,Reward_lang,Title_lang
12167,"Hai terminato la Stagione 6 del PvP di Legion tra i primi 0,5% nella graduatoria delle arene (richiede almeno 150 battaglie vinte con la tua fazione attuale durante la Stagione 6 di Legion).","Ricompensa: titolo ""Gladiatore""",Gladiatore: Stagione 6 di Legion
12168,"Hai terminato la Stagione 7 del PvP di Legion tra i primi 0,5% nella graduatoria delle arene (richiede almeno 150 battaglie vinte con la tua fazione attuale durante la Stagione 7 di Legion).","Ricompensa: titolo ""Gladiatore""",Gladiatore: Stagione 7 di Legion
12169,Hai terminato la Stagione 6 del PvP di Legion tra i primi 35% nella graduatoria delle arene (richiede almeno 50 battaglie vinte con la tua fazione attuale durante la Stagione 6 di Legion).,"Ricompensa: titolo ""Sfidante""",Sfidante: Stagione 6 di Legion
12170,Hai terminato la Stagione 6 del PvP di Legion tra i primi 10% nella graduatoria delle arene (richiede almeno 50 battaglie vinte con la tua fazione attuale durante la Stagione 6 di Legion).,"Ricompensa: titolo ""Rivale""",Rivale: Stagione 6 di Legion
12171,Hai terminato la Stagione 6 del PvP di Legion tra i primi 3% nella graduatoria delle arene (richiede almeno 50 battaglie vinte con la tua fazione attuale durante la Stagione 6 di Legion).,"Ricompensa: titolo ""Duellante""",Duellante: Stagione 6 di Legion
12172,"Hai terminato la Stagione 6 del PvP di Legion tra i primi 0,5% nella graduatoria dei campi di battaglia classificati (richiede almeno 50 battaglie vinte con la tua fazione attuale durante la Stagione 6 di Legion).",,Eroe dell'Orda: Dominante
12173,"Hai terminato la Stagione 6 del PvP di Legion tra i primi 0,5% nella graduatoria dei campi di battaglia classificati (richiede almeno 50 battaglie vinte con la tua fazione attuale durante la Stagione 6 di Legion).",,Eroe dell'Alleanza: Dominante
12174,Hai terminato la Stagione 6 del PvP di Legion tra i primi 10% nella graduatoria dei campi di battaglia classificati (richiede almeno 50 battaglie vinte con la tua fazione attuale durante la Stagione 6 di Legion).,"Ricompensa: titolo ""Difensore dell'Orda""",Difensore dell'Orda: Stagione 6 di Legion
12175,Hai terminato la Stagione 6 del PvP di Legion tra i primi 10% nella graduatoria dei campi di battaglia classificati (richiede almeno 50 battaglie vinte con la tua fazione attuale durante la Stagione 6 di Legion).,"Ricompensa: titolo ""Difensore dell'Alleanza""",Difensore dell'Alleanza: Stagione 6 di Legion
12176,Hai terminato la Stagione 6 del PvP di Legion tra i primi 3% nella graduatoria dei campi di battaglia classificati (richiede almeno 50 battaglie vinte con la tua fazione attuale durante la Stagione 6 di Legion).,"Ricompensa: titolo ""Guardiano dell'Orda""",Guardiano dell'Orda: Stagione 6 di Legion
12177,Hai terminato la Stagione 6 del PvP di Legion tra i primi 3% nella graduatoria dei campi di battaglia classificati (richiede almeno 50 battaglie vinte con la tua fazione attuale durante la Stagione 6 di Legion).,"Ricompensa: titolo ""Guardiano dell'Alleanza""",Guardiano dell'Alleanza: Stagione 6 di Legion
12178,Hai terminato la Stagione 6 del PvP di Legion tra i primi 35% nella graduatoria dei campi di battaglia classificati (richiede almeno 50 battaglie vinte con la tua fazione attuale durante la Stagione 6 di Legion).,"Ricompensa: titolo ""Soldato dell'Orda""",Soldato dell'Orda: Stagione 6 di Legion
12179,Hai terminato la Stagione 6 del PvP di Legion tra i primi 35% nella graduatoria dei campi di battaglia classificati (richiede almeno 50 battaglie vinte con la tua fazione attuale durante la Stagione 6 di Legion).,"Ricompensa: titolo ""Soldato dell'Alleanza""",Soldato dell'Alleanza: Stagione 6 di Legion
12180,Raggiungi il Grado Prestigio 22.,,Ventidue gradi di maestria
12181,Raggiungi il Grado Prestigio 23.,,Protocollo 2.3
12182,Raggiungi il Grado Prestigio 24.,,Doppia dozzina demoniaca
12183,Raggiungi il Grado Prestigio 25.,,Un quartino di prestigio
12184,,,Crogiolo di Lucefatua - Almeno un potere della reliquia sbloccato
12185,"Hai terminato la Stagione 7 del PvP di Legion tra i primi 0,1% nella graduatoria delle arene (richiede almeno 150 battaglie vinte con la tua fazione attuale durante la Stagione 7 di Legion).","Ricompensa: titolo ""Gladiatore Demoniaco""",Gladiatore Demoniaco: Stagione 7 di Legion
12186,Hai terminato la Stagione 7 del PvP di Legion tra i primi 3% nella graduatoria delle arene (richiede almeno 50 battaglie vinte con la tua fazione attuale durante la Stagione 7 di Legion).,"Ricompensa: titolo ""Duellante""",Duellante: Stagione 7 di Legion
12187,Hai terminato la Stagione 7 del PvP di Legion tra i primi 35% nella graduatoria delle arene (richiede almeno 50 battaglie vinte con la tua fazione attuale durante la Stagione 7 di Legion).,"Ricompensa: titolo ""Sfidante""",Sfidante: Stagione 7 di Legion
12188,Hai terminato la Stagione 7 del PvP di Legion tra i primi 10% nella graduatoria delle arene (richiede almeno 50 battaglie vinte con la tua fazione attuale durante la Stagione 7 di Legion).,"Ricompensa: titolo ""Rivale""",Rivale: Stagione 7 di Legion
12189,Hai terminato la Stagione 7 del PvP di Legion tra i primi 35% nella graduatoria dei campi di battaglia classificati (richiede almeno 50 battaglie vinte con la tua fazione attuale durante la Stagione 7 di Legion).,"Ricompensa: titolo ""Soldato dell'Alleanza""",Soldato dell'Alleanza: Stagione 7 di Legion
12190,Hai terminato la Stagione 7 del PvP di Legion tra i primi 35% nella graduatoria dei campi di battaglia classificati (richiede almeno 50 battaglie vinte con la tua fazione attuale durante la Stagione 7 di Legion).,"Ricompensa: titolo ""Soldato dell'Orda""",Soldato dell'Orda: Stagione 7 di Legion
12191,Hai terminato la Stagione 7 del PvP di Legion tra i primi 3% nella graduatoria dei campi di battaglia classificati (richiede almeno 50 battaglie vinte con la tua fazione attuale durante la Stagione 7 di Legion).,"Ricompensa: titolo ""Guardiano dell'Alleanza""",Guardiano dell'Alleanza: Stagione 7 di Legion
12192,Hai terminato la Stagione 7 del PvP di Legion tra i primi 3% nella graduatoria dei campi di battaglia classificati (richiede almeno 50 battaglie vinte con la tua fazione attuale durante la Stagione 7 di Legion).,"Ricompensa: titolo ""Guardiano dell'Orda""",Guardiano dell'Orda: Stagione 7 di Legion
12194,Hai terminato la Stagione 7 del PvP di Legion tra i primi 10% nella graduatoria dei campi di battaglia classificati (richiede almeno 50 battaglie vinte con la tua fazione attuale durante la Stagione 7 di Legion).,"Ricompensa: titolo ""Difensore dell'Orda""",Difensore dell'Orda: Stagione 7 di Legion
12195,Hai terminato la Stagione 7 del PvP di Legion tra i primi 10% nella graduatoria dei campi di battaglia classificati (richiede almeno 50 battaglie vinte con la tua fazione attuale durante la Stagione 7 di Legion).,"Ricompensa: titolo ""Difensore dell'Alleanza""",Difensore dell'Alleanza: Stagione 7 di Legion
12196,"Hai terminato la Stagione 7 del PvP di Legion tra i primi 0,5% nella graduatoria dei campi di battaglia classificati (richiede almeno 50 battaglie vinte con la tua fazione attuale durante la Stagione 7 di Legion).",,Eroe dell'Orda: Demoniaco
12197,"Hai terminato la Stagione 7 del PvP di Legion tra i primi 0,5% nella graduatoria dei campi di battaglia classificati (richiede almeno 50 battaglie vinte con la tua fazione attuale durante la Stagione 7 di Legion).",,Eroe dell'Alleanza: Demoniaco
12198,Raggiungi un indice di valutazione di 2.000 in qualsiasi categoria del PvP classificato durante la Stagione 7 di Legion.,,Demoniaco Élite
12199,Vinci 100 arene (3v3) o 40 campi di battaglia classificati durante la Stagione 7 di Legion.,Ricompensa: Sella Malvagia,Combattente Demoniaco
12200,Vinci 100 arene (3v3) o 40 campi di battaglia classificati durante la Stagione 7 di Legion.,Ricompensa: Sella Malvagia,Combattente Demoniaco
12229,Possessore della cavalcatura Stallone Marino della Collector's Edition di Battle for Azeroth.,,Collector's Edition: Stallone Marino
12230,Possessore della cavalcatura Devasauro Dorato della Collector's Edition di Battle for Azeroth.,,Collector's Edition: Devasauro Dorato
12232,Possessore della mascotte Tarta della Collector's Edition di Battle for Azeroth.,,Collector's Edition: Tarta
12242,Ottieni la fedeltà degli Elfi del Vuoto e accoglili nei ranghi dell'Alleanza.,Ricompensa: Razza Elfi del Vuoto sbloccata,Razze Alleate: Elfi del Vuoto
12243,Ottieni la fedeltà dei Draenei Forgialuce e accoglili nei ranghi dell'Alleanza.,Ricompensa: Razza Draenei Forgialuce sbloccata,Razze Alleate: Draenei Forgialuce
12244,Ottieni la fedeltà dei Nobili Oscuri e accoglili nei ranghi dell'Orda.,Ricompensa: Razza Nobili Oscuri sbloccata,Razze Alleate: Nobili Oscuri
12245,Ottieni la fedeltà dei Tauren di Alto Monte e accoglili nei ranghi dell'Orda.,Ricompensa: Razza Tauren di Alto Monte sbloccata,Razze Alleate: Tauren di Alto Monte
12257,"Recupera 20 Granuli di Potere Titanico entro 5 secondi e sconfiggi Argus il Distruttore ad Antorus, il Trono Infuocato in modalità Normale o superiore.",,Crociati stellari
12258,"La prima gilda del reame a sconfiggere Argus il Distruttore ad Antorus, il Trono Infuocato in modalità Mitica con un gruppo di gilda.",,Primi del reame! Argus il Distruttore
12266,,,Incursione Argus - Argus il Distruttore sconfitto
12270,Sconfiggi i quattro boss ad Atal'dazar in modalità Mitica con almeno un membro del gruppo sotto gli effetti di Maleficio Instabile.,,Instabilmente malefico
12272,Sconfiggi la Sacerdotessa Alun'za ad Atal'dazar in modalità Mitica dopo aver sconfitto la Corruzione Fatale.,,Febbre dell'oro
12273,Sconfiggi Yazma ad Atal'dazar in modalità Mitica con tutti i quattro Candelieri di Ombrofuoco accesi.,,Li accendiamo?
12279,"Vinci 10 scontri PvP tra mascotte tramite ""Trova scontro"" con una squadra composta solo da mascotte Meccaniche di livello 25.",,Allenatore meccanico
12280,"Vinci 10 scontri PvP tra mascotte tramite ""Trova scontro"" con una squadra composta solo da mascotte Acquatiche di livello 25.",,Allenatore acquatico
12281,"Vinci 10 scontri PvP tra mascotte tramite ""Trova scontro"" con una squadra composta solo da mascotte Bestiali di livello 25.",,Allenatore bestiale
12282,"Vinci 10 scontri PvP tra mascotte tramite ""Trova scontro"" con una squadra composta solo da mascotte Elementali di livello 25.",,Allenatore elementale
12283,"Vinci 10 scontri PvP tra mascotte tramite ""Trova scontro"" con una squadra composta solo da mascotte Magiche di livello 25.",,Allenatore magico
12284,"Vinci 10 scontri PvP tra mascotte tramite ""Trova scontro"" con una squadra composta solo da mascotte Animali di livello 25.",,Allenatore animale
12285,"Vinci 10 scontri PvP tra mascotte tramite ""Trova scontro"" con una squadra composta solo da mascotte Non Morte di livello 25.",,Allenatore non morto
12286,"Vinci 10 scontri PvP tra mascotte tramite ""Trova scontro"" con una squadra composta solo da mascotte Volanti di livello 25.",,Allenatore volante
12287,"Vinci 10 scontri PvP tra mascotte tramite ""Trova scontro"" con una squadra composta solo da mascotte Dragoidi di livello 25.",,Allenatore dragoide
12289,"Vinci 10 scontri PvP tra mascotte tramite ""Trova scontro"" con una squadra composta solo da mascotte Umanoidi di livello 25.",,Allenatore umanoide
12290,Compi le seguenti imprese.,Ricompensa: Insegna del Maestro Allenatore,Allenatore di famiglia
12291,Raggiungi il livello 50 con un nuovo personaggio Elfo del Vuoto.,Ricompensa: Armatura Retaggio degli Elfi del Vuoto,Il retaggio del Vuoto
12292,Diventa Osannato dalla Tribù Alto Monte.,,Tribù Alto Monte
12297,Sconfiggi i boss della zona dell'Assedio a Ulduar.,,Assedio di Ulduar
12302,Sconfiggi i boss dell'Anticamera di Ulduar.,,Anticamera di Ulduar
12309,Sconfiggi i Guardiani di Ulduar.,,Guardiani di Ulduar
12310,Sconfiggi i boss della Discesa nella Follia di Ulduar.,,Discesa nella Follia
12311,Sconfiggi tutti i boss di Ulduar.,,Segreti di Ulduar
12312,Distruggi 100 Difensori Forgiacciaio entro 10 secondi nel Viale di Ferro all'entrata di Ulduar.,,Nanogeddon
12313,Sconfiggi il Leviatano delle Fiamme a Ulduar al primo tentativo senza che alcun giocatore ripari il proprio veicolo.,,Salvezza
12314,Sconfiggi il Leviatano delle Fiamme a Ulduar con ciascuno dei seguenti veicoli.,,Officina
12315,Distruggi una torretta difensiva del Leviatano delle Fiamme a Ulduar.,,Eliminate quelle torrette!
12316,Sconfiggi il Leviatano delle Fiamme a Ulduar senza causare uno spegnimento del sistema.,,Arresto del sistema
12317,Sconfiggi il Leviatano delle Fiamme a Ulduar con almeno un Sistema di Difesa Orbitale attivo.,,Bombardamento Orbitale
12318,Sconfiggi il Leviatano delle Fiamme a Ulduar con almeno due Sistemi di Difesa Orbitali attivi.,,Devastazione orbitale
12319,Sconfiggi il Leviatano delle Fiamme a Ulduar con almeno tre Sistemi di Difesa Orbitali attivi.,,Nuclearizzazione orbitale
12320,Sconfiggi il Leviatano delle Fiamme a Ulduar con tutti i quattro Sistemi di Difesa Orbitali attivi.,,Orbitorio
12321,Sconfiggi Scagliafusa a Ulduar senza permetterle di alzarsi in volo più di una volta.,,Fusione rapida
12322,Sconfiggi 25 Nani Guardiani della Runa Oscura con Alito di Fuoco di Scagliafusa a Ulduar.,,Ci metto il Nano sul fuoco
12323,Sconfiggi il Maestro della Forgia Ignis a Ulduar dopo aver distrutto 2 Costrutti di Ferro entro 5 secondi.,,Infranto
12324,Sopravvivi quando vieni lanciato nel Paiolo Vulcanico del Maestro della Forgia Ignis a Ulduar.,,Caldo mortale
12325,Sconfiggi il Maestro della Forgia Ignis a Ulduar entro 4 minuti.,,Fiamma viva
12326,Sconfiggi il Demolitore XT-002 a Ulduar senza permettergli di recuperare salute dagli Scartobot XS-013.,,Retroingegneria
12327,"Mentre combatti il Demolitore XT-002 a Ulduar, sconfiggi 20 Scartobot XS-013 entro 12 secondi.",,Depotenziate gli Scartobot!
12328,Sconfiggi il Demolitore XT-002 a Ulduar senza che alcun membro dell'incursione muoia a causa di una Bomba Gravitazionale.,,Depotenziate le bombe gravitazionali!
12329,Sconfiggi il Demolitore XT-002 a Ulduar entro 205 secondi.,,Demolizione rapida
12330,Sconfiggi il Demolitore XT-002 a Ulduar dopo aver distrutto il suo Cuore.,,Cuore Infranto
12332,Sconfiggi l'Adunanza del Ferro a Ulduar uccidendo per ultimo il Maestro Runico Molgeim.,,"Maestro Runico Molgeim, scelgo te!"
12333,Sconfiggi l'Adunanza del Ferro a Ulduar uccidendo per ultimo l'Invocatore delle Tempeste Brundir.,,"Invocatore delle Tempeste Brundir, scelgo te!"
12334,Sconfiggi l'Adunanza del Ferro a Ulduar uccidendo per ultimo Spaccacciaio.,,"Spaccacciaio, scelgo te!"
12335,Sconfiggi l'Adunanza del Ferro a Ulduar mentre sei sotto l'effetto del Tonico dello Stivale di Ferro.,,Sono dalla tua parte!
12336,Sconfiggi l'Adunanza del Ferro a Ulduar senza che l'Invocatore delle Tempeste Brundir colpisca qualcuno con la Catena di Fulmini o il Turbinio di Fulmini.,,Fulminati
12337,Sconfiggi Kologarn a Ulduar senza distruggere le sue braccia.,,A braccia aperte
12338,Distruggi entrambe le braccia e poi Kologarn stesso entro 12 secondi a Ulduar.,,Disarmato
12339,Sconfiggi Kologarn a Ulduar senza che alcun membro dell'incursione venga colpito dai Raggi Focalizzati.,,Sguardo che uccide
12340,Sconfiggi Kologarn a Ulduar dopo aver fatto comparire almeno 25 Detriti.,,Macerie fumanti
12341,Sconfiggi Auriaya a Ulduar senza uccidere i suoi Avvistatori del Santuario.,,Gattara
12342,Sconfiggi Auriaya a Ulduar dopo aver ucciso il Difensore Ferino.,,Sette vite
12343,Sconfiggi Hodir a Ulduar senza che alcun membro dell'incursione venga colpito da Prigione di Ghiaccio.,,Paresi facciale
12344,Sconfiggi Hodir a Ulduar senza che alcun avventuriero congelato muoia.,,Amici in gamba
12345,Sconfiggi Hodir a Ulduar senza che alcun membro dell'incursione subisca più di due accumuli di Freddo Pungente.,,Inizia a far caldo qui
12346,"Mentre combatti Hodir a Ulduar, sfrutta i benefici di Fuoco Scoppiettante, Forza della Tempesta e Luce Stellare contemporaneamente.",,Pronto ad affrontare l'inverno
12347,Sconfiggi Hodir a Ulduar prima che distrugga il suo Raro Forziere dell'Inverno.,,Roba rara
12348,Sconfiggi Thorim a Ulduar senza che alcun membro dell'incursione venga colpito dalla Carica Fulminante.,,Occhio ai fulmini
12349,"Mentre combatti Thorim a Ulduar, partecipa all'uccisione del Gigante Runico Antico e del Colosso Runico.",,Più botte per tutti!
12350,Sconfiggi Thorim a Ulduar mentre sei sotto l'effetto dell'Aura della Velocità.,,"Brama di Sangue? No, grazie!"
12351,"Mentre combatti Thorim a Ulduar, costringilo a gettarsi nell'arena prima della scomparsa di Sif.",,Tra moglie e marito non mettere il dito
12352,Sconfiggi Thorim a Ulduar mentre Sif è presente.,,Perdita dell'illusione
12360,"Sconfiggi l'Anziano Frondachiara, l'Anziano Ramoduro e l'Anziano Scorzapietra a Ulduar entro 15 secondi l'uno dall'altro.",,Falegnameria
12361,Sconfiggi Freya a Ulduar entro 20 minuti dall'uccisione della prima creatura nella Serra della Vita.,,Effetto serra
12362,"Mentre combatti Freya a Ulduar, sconfiggi 2 Spiriti Antichi dell'Acqua, 2 Piante Sferzanti della Tempesta e 2 Schioccafrusta entro 10 secondi.",,Deforestazione
12363,Sconfiggi Freya a Ulduar mentre ha almeno 25 accumuli di Sintonia con la Natura.,,Ritorno alla natura
12364,Sconfiggi Freya a Ulduar con almeno un Anziano ancora vivo.,,Se prima ero da solo...
12365,Sconfiggi Freya a Ulduar con almeno due Anziani ancora vivi.,,...adesso siamo in due
12366,Sconfiggi Freya a Ulduar con tutti i tre Anziani ancora vivi.,,Se prima eravamo in due...
12367,Sconfiggi Mimiron a Ulduar senza che alcun membro dell'incursione venga colpito dai seguenti oggetti.,,Bombe innescate
12368,"Mentre combatti Mimiron a Ulduar, costringilo a distruggere un Robot d'Assalto con un Assalto a Razzo.",,Fuoco Non Tanto Amico
12369,Sconfiggi Mimiron a Ulduar dopo che ha attivato il suo meccanismo di autodistruzione.,,Vigile del fuoco
12372,Sconfiggi il Generale Vezax a Ulduar senza che alcun membro dell'incursione venga colpito dall'Impatto d'Ombra,,Schivaombre
12373,Sconfiggi il Generale Vezax a Ulduar dopo aver ucciso l'Animus di Saronite.,,Mi piace l'odore della Saronite al mattino
12384,/bacia Sara a Ulduar mentre è arrabbiata con te.,,Il tuo bacio è come un Yogg
12385,Sconfiggi Yogg-Saron a Ulduar con l'aiuto di non più di tre Guardiani.,,Tre luci nell'oscurità
12386,Sconfiggi Yogg-Saron a Ulduar con l'aiuto di non più di due Guardiani.,,Due luci nell'Oscurità
12387,Sconfiggi Yogg-Saron a Ulduar con l'aiuto di non più di un Guardiano.,,Una luce nell'oscurità
12388,Sconfiggi Yogg-Saron a Ulduar senza l'aiuto di alcun Guardiano.,,Solo nell'Oscurità
12395,Sconfiggi Yogg-Saron a Ulduar senza che alcun membro dell'incursione impazzisca.,,Mi fa impazzire
12396,Sconfiggi Yogg-Saron a Ulduar entro 7 minuti.,,Vecchiaia negata
12397,"Mentre tenti di salvare Sara da Yogg-Saron a Ulduar, sconfiggi 9 Guardiani di Yogg-Saron entro 12 secondi.",,Escono dalle #@*# pareti!
12398,Assisti a tutte e 3 le visioni della mente di Yogg-Saron a Ulduar.,,Nella sua dimora egli attende sognando
12399,Sconfiggi Algalon l'Osservatore a Ulduar.,"Ricompensa: titolo ""il Viaggiatore Astrale"" e ""l'Effige delle Stelle""",Osservato
12400,Sconfiggi Algalon l'Osservatore a Ulduar dopo aver chiuso 3 Buchi Neri entro 10 secondi.,,Supermassiccio
12401,Compi le imprese delle incursioni di Ulduar elencate qui sotto.,"Ricompensa: cavalcature ""Proto-Draco Rugginoso"" e ""Proto-Draco Ferroso""",Gloria dell'incursore di Ulduar
12404,Raccogli campioni da un Deposito d'Azerite entro 30 secondi dall'arrivo sulla Spiaggia Ribollente.,,Abusivismo
12405,Uccidi un nemico entro 30 secondi dall'arrivo sulla Spiaggia Ribollente.,,Morte dall'alto
12406,Raccogli 25.000 campioni di Azerite sulla Spiaggia Ribollente.,,Un buon inizio
12407,Vinci una battaglia sulla Spiaggia Ribollente con un punteggio di 1.500 a 0.,,"Mamma, butta la pasta!"
12408,Raccogli Azerite in ciascuno dei luoghi della Spiaggia Ribollente elencati qui sotto:,,Dominazione sulla Spiaggia Ribollente
12409,Vinci una battaglia sulla Spiaggia Ribollente.,,Vittoria sulla Spiaggia Ribollente
12410,Conquista 100 vittorie sulla Spiaggia Ribollente.,,Veterano della Spiaggia Ribollente
12411,Uccidi 50 nemici vicino a un Deposito d'Azerite.,,Sangue e sabbia
12412,Compi le imprese sulla Spiaggia Ribollente elencate qui sotto.,"Ricompensa: titolo ""Prospettore""",Maestro della Spiaggia Ribollente
12413,Raggiungi il livello 50 con un nuovo personaggio Nobile Oscuro.,Ricompensa: Armatura Retaggio dei Nobili Oscuri,Il retaggio dei Nobili Oscuri
12414,Raggiungi il livello 50 con un nuovo personaggio Draenei Forgialuce.,Ricompensa: Armatura Retaggio dei Draenei Forgialuce,Il retaggio dei Forgialuce
12415,Raggiungi il livello 50 con un nuovo personaggio Tauren di Alto Monte.,Ricompensa: Armatura Retaggio dei Tauren di Alto Monte,Il retaggio dei Tauren di Alto Monte
12416,Trova il Postino a Dalaran e offrigli il tuo aiuto.,,Pacchetto completo
12429,Completa i gruppi di missioni delle Paludi Grigie elencati qui sotto.,,Missioni delle Paludi Grigie
12430,Completa i gruppi di missioni di Boscovespro elencati qui sotto.,,Missioni di Boscovespro
12431,Smista 30 lettere entro 60 secondi nell'Ufficio del Postino.,"Ricompensa: mascotte ""Elementale della Posta""",Velocità di smistamento
12439,Smista 30 lettere con indirizzo parziale entro 60 secondi nell'Ufficio del Postino.,"Ricompensa: titolo ""Postino""",Posta prioritaria
12445,,,Razze Alleate: requisiti per sbloccare i Tauren di Alto Monte
12446,,,Razze Alleate: requisiti per sbloccare i Nobili Oscuri
12447,,,Razze Alleate: requisiti per sbloccare gli Elfi del Vuoto
12448,,,Razze Alleate: requisiti per sbloccare i Draenei Forgialuce
12450,Completa la missione qui sotto.,Ricompensa: Razza Elfi del Vuoto sbloccata,
12451,Completa la missione qui sotto.,Ricompensa: Razza Draenei Forgialuce sbloccata,
12452,Completa la missione qui sotto.,Ricompensa: Razza Tauren di Alto Monte sbloccata,
12453,Completa la missione qui sotto.,Ricompensa: Razza Nobili Oscuri sbloccata,
12454,"Durante la settimana del ventesimo anniversario di StarCraft, pubblicato il 31 marzo 1998, rendi onore con il saluto /militare (o /salute) a una delle seguenti mascotte dell'universo di StarCraft: Zergling, Grugny, Mini Thor, Baneling o Zeradar.",,Onore a StarCraft
12455,Completa i gruppi di missioni delle Marche Occidentali e di Boscovespro.,,Missioni delle Marche Occidentali e Boscovespro
12456,Completa i gruppi di missioni di Loch Modan e delle Paludi Grigie.,,Missioni di Loch Modan e delle Paludi Grigie
12457,Sconfiggi il Capitano Cavaliere Valyri a Tol Dagor in modalità Mitica senza far esplodere alcuna Munizione.,,Attenti al fuoco
12462,Sconfiggi il Sovrintendente Korgus a Tol Dagor in modalità Mitica dopo che tutti i membri del gruppo sono stati storditi dal Veleno Fermacuori allo stesso tempo.,,Colpo al Cuore
12472,,,
12473,Completa i gruppi di missioni della Baia di Tiragarde elencati qui sotto.,,Tenerli a Baia
12478,Completa i gruppi di missioni di Vol'dun elencati qui sotto.,,Segreti nelle sabbie
12479,Compi le seguenti imprese sul continente di Zandalar.,,Zandalar per sempre!
12480,Completa la serie di missioni della Porta Insanguinata a Zuldazar.,,Un patto di sangue
12481,"Completa lo scenario ""Zandalar per sempre"" a Zuldazar.",,L'ultimo sigillo
12482,Completa i seguenti incarichi per Jani a Zandalar.,,A Jani nude
12483,Sconfiggi Gorak Tul nel Maniero dei Crestabianca.,,Maniero dei Crestabianca
12484,Sconfiggi Gorak Tul nel Maniero dei Crestabianca in modalità Eroica o superiore.,,Eroica: Maniero dei Crestabianca
12488,Sconfiggi Gorak Tul nel Maniero dei Crestabianca in modalità Mitica.,,Mitica: Maniero dei Crestabianca
12489,Trova e uccidi tutti i nemici elencati qui sotto nel Maniero dei Crestabianca e nell'Assedio di Boralus in modalità Mitica.,,Assassino di professione
12490,Distruggi tre corpi di Schiavisti Sfiorati dalla Morte usando un solo Fuoco Alchemico e poi sconfiggi Gorak Tul nel Maniero dei Crestabianca in modalità Mitica.,,Romanticismo alchemico
12495,Sconfiggi il Goliath Vincolato senza che raggiunga 12 accumuli di Mietitura delle Anime nel Maniero dei Crestabianca in modalità Mitica.,,Corri come sui carboni ardenti
12496,Completa i gruppi di missioni della Valle dei Sacraonda elencati qui sotto.,,Sacre danze
12497,Completa i gruppi di missioni di Drustvar elencati qui sotto.,,Quattro amici al Drustbar
12498,Sconfiggi l'Anziana Leaxa a Grottamarcia in modalità Mitica senza che alcun membro del gruppo venga colpito da Contaminazione di G'huun.,,Difese immunitarie
12499,Sconfiggi l'Abominio Indomabile a Grottamarcia in modalità Mitica senza che muoia alcuna Spora Marcia.,,Danni sporadici
12500,Sconfiggi l'Abominio Indomabile a Grottamarcia.,,Grottamarcia
12501,Sconfiggi l'Abominio Indomabile a Grottamarcia in modalità Eroica o superiore.,,Eroica: Grottamarcia
12502,Sconfiggi l'Abominio Indomabile a Grottamarcia in modalità Mitica.,,Mitica: Grottamarcia
12503,Attiva entrambi gli occhi entro 10 secondi l'uno dall'altro per uscire dal Bazar nel Tempio di Sethraliss in modalità Mitica.,,Occhi di serpente
12504,Ripristina l'Avatar di Sethraliss nel Tempio di Sethraliss.,,Tempio di Sethraliss
12505,Ripristina l'Avatar di Sethraliss nel Tempio di Sethraliss in modalità Eroica o superiore.,,Eroica: Tempio di Sethraliss
12506,Ripristina l'Avatar di Sethraliss nel Tempio di Sethraliss in modalità Mitica.,,Mitica: Tempio di Sethraliss
12507,"Fai schiudere l'Uovo Solido durante lo scontro con Merektha, quindi uccidi il Serpente Solido e diventa il Mangiatore di Serpenti nel Tempio di Sethraliss in modalità Mitica.",,Mangiatore di Serpenti
12508,Ripristina l'Avatar di Sethraliss nel Tempio di Sethraliss con il Principe attivo in modalità Mitica.,,"Buonanotte, giovane Principe"
12509,Completa la Campagna di Guerra a Zandalar e Kul Tiras.,,Pronti per la guerra
